{
  "version": 7,
  "updatedAt": "2026-10-20T15:27:47.549596+00:00",
  "config": {
    "cadence": "Mon/Wed/Fri + event specials",
    "timezone": "America/Los_Angeles",
    "themes": {
      "seasonal": {
        "color": "#ff7a45",
        "label": "Seasonal"
      },
      "worldcup": {
        "color": "#16a34a",
        "label": "World Cup"
      },
      "meme": {
        "color": "#7c3aed",
        "label": "Meme"
      },
      "proof": {
        "color": "#0ea5e9",
        "label": "Proof"
      },
      "brand": {
        "color": "#1f80ff",
        "label": "Brand"
      }
    }
  },
  "markers": {
    "2026-07-01": {
      "label": "⚽ USA vs Bosnia · R32",
      "type": "evt"
    },
    "2026-07-03": {
      "label": "Tour de France begins",
      "type": "evt"
    },
    "2026-07-04": {
      "label": "🇺🇸 Independence Day",
      "type": "hol"
    },
    "2026-07-10": [
      {
        "label": "MLB All-Star Week begins",
        "type": "evt"
      },
      {
        "label": "Summer Fridays",
        "type": "mkt"
      }
    ],
    "2026-07-11": {
      "label": "⚽ Quarter-finals",
      "type": "evt"
    },
    "2026-07-12": [
      {
        "label": "🎾 Wimbledon Final",
        "type": "evt"
      },
      {
        "label": "MLB All-Star Sunday",
        "type": "evt"
      }
    ],
    "2026-07-13": {
      "label": "MLB Home Run Derby",
      "type": "evt"
    },
    "2026-07-14": {
      "label": "MLB All-Star Game",
      "type": "evt"
    },
    "2026-07-15": [
      {
        "label": "⚽ Semi-finals",
        "type": "evt"
      },
      {
        "label": "Mid-July move check-in",
        "type": "mkt"
      }
    ],
    "2026-07-19": {
      "label": "⚽ World Cup Final",
      "type": "evt"
    },
    "2026-07-22": {
      "label": "Comic-Con Preview Night",
      "type": "evt"
    },
    "2026-07-23": {
      "label": "San Diego Comic-Con",
      "type": "evt"
    },
    "2026-07-25": {
      "label": "WNBA All-Star Game",
      "type": "evt"
    },
    "2026-07-26": [
      {
        "label": "Parents' Day",
        "type": "hol"
      },
      {
        "label": "Tour de France ends",
        "type": "evt"
      },
      {
        "label": "Comic-Con ends",
        "type": "evt"
      }
    ],
    "2026-07-31": {
      "label": "Last July weekend",
      "type": "mkt"
    },
    "2026-08-07": {
      "label": "International Beer Day",
      "type": "evt"
    },
    "2026-08-09": {
      "label": "Book Lovers Day",
      "type": "evt"
    },
    "2026-08-12": {
      "label": "International Youth Day",
      "type": "evt"
    },
    "2026-08-17": {
      "label": "🎒 Back-to-school season",
      "type": "mkt"
    },
    "2026-08-19": {
      "label": "World Photography Day",
      "type": "evt"
    },
    "2026-08-23": {
      "label": "US Open Fan Week begins",
      "type": "evt"
    },
    "2026-08-26": {
      "label": "National Dog Day",
      "type": "evt"
    },
    "2026-08-30": {
      "label": "US Open main draw begins",
      "type": "evt"
    },
    "2026-08-31": {
      "label": "Labor Day weekend ramp",
      "type": "mkt"
    },
    "2026-09-02": {
      "label": "Venice Film Festival begins",
      "type": "evt"
    },
    "2026-09-07": {
      "label": "Labor Day",
      "type": "hol"
    },
    "2026-09-09": {
      "label": "NFL Kickoff",
      "type": "evt"
    },
    "2026-09-10": [
      {
        "label": "TIFF begins",
        "type": "evt"
      },
      {
        "label": "New York Fashion Week begins",
        "type": "evt"
      }
    ],
    "2026-09-11": {
      "label": "Patriot Day",
      "type": "hol"
    },
    "2026-09-12": {
      "label": "Venice Film Festival ends",
      "type": "evt"
    },
    "2026-09-13": {
      "label": "US Open Final",
      "type": "evt"
    },
    "2026-09-15": {
      "label": "NYFW ends",
      "type": "evt"
    },
    "2026-09-20": {
      "label": "TIFF ends",
      "type": "evt"
    },
    "2026-09-22": {
      "label": "First day of fall",
      "type": "mkt"
    },
    "2026-09-27": {
      "label": "Good Neighbor Day",
      "type": "evt"
    },
    "2026-10-05": {
      "label": "World Teachers' Day",
      "type": "evt"
    },
    "2026-10-10": {
      "label": "World Mental Health Day",
      "type": "evt"
    },
    "2026-10-12": {
      "label": "Indigenous Peoples’ Day",
      "type": "hol"
    },
    "2026-10-16": {
      "label": "Boss's Day",
      "type": "evt"
    },
    "2026-10-24": {
      "label": "Make a Difference Day",
      "type": "evt"
    },
    "2026-10-31": {
      "label": "🎃 Halloween",
      "type": "evt"
    },
    "2026-11-01": {
      "label": "Daylight Saving Time ends",
      "type": "mkt"
    },
    "2026-11-03": {
      "label": "🗳️ Election Day",
      "type": "evt"
    },
    "2026-11-08": {
      "label": "Diwali",
      "type": "hol"
    },
    "2026-11-11": {
      "label": "Veterans Day",
      "type": "hol"
    },
    "2026-11-13": {
      "label": "World Kindness Day",
      "type": "evt"
    },
    "2026-11-26": {
      "label": "🦃 Thanksgiving",
      "type": "hol"
    },
    "2026-11-27": {
      "label": "🛍️ Black Friday",
      "type": "mkt"
    },
    "2026-11-28": {
      "label": "Small Business Saturday",
      "type": "mkt"
    },
    "2026-11-30": {
      "label": "Cyber Monday",
      "type": "mkt"
    },
    "2026-12-01": {
      "label": "Giving Tuesday",
      "type": "mkt"
    },
    "2026-12-04": {
      "label": "Hanukkah begins",
      "type": "hol"
    },
    "2026-12-07": {
      "label": "Pearl Harbor Remembrance Day",
      "type": "hol"
    },
    "2026-12-21": {
      "label": "First day of winter",
      "type": "mkt"
    },
    "2026-12-24": {
      "label": "Christmas Eve",
      "type": "hol"
    },
    "2026-12-25": {
      "label": "🎄 Christmas",
      "type": "hol"
    },
    "2026-12-26": [
      {
        "label": "Kwanzaa begins",
        "type": "hol"
      },
      {
        "label": "Boxing Day",
        "type": "hol"
      }
    ],
    "2026-12-31": {
      "label": "🎉 New Year’s Eve",
      "type": "evt"
    },
    "2027-01-01": {
      "label": "New Year’s Day",
      "type": "hol"
    },
    "2027-01-18": {
      "label": "Martin Luther King Jr. Day",
      "type": "hol"
    },
    "2027-02-14": [
      {
        "label": "Valentine's Day",
        "type": "hol"
      },
      {
        "label": "Super Bowl LXI",
        "type": "evt"
      }
    ]
  },
  "posts": [
    {
      "id": "seed-0",
      "status": "scheduled",
      "date": "2026-07-01",
      "title": "Are You Busy This Month?",
      "theme": "meme",
      "fmt": "Carousel · 2 slides",
      "holiday": "",
      "caption": "Monthly opener. Packed calendar of chores vs. a wide-open beach month with Opendoor.",
      "socialCaption": "your whole month, gone. or your whole month, yours. 🏖️",
      "canva": "DAHN-8eHiBA",
      "media": {
        "img": "previews/busy-month.png",
        "slides": [
          "previews/slides/busy-1.png",
          "previews/slides/busy-2.png"
        ],
        "video": ""
      },
      "postedUrl": "",
      "updatedAt": "2026-07-16T16:05:50.310Z"
    },
    {
      "id": "seed-1",
      "status": "scheduled",
      "date": "2026-07-01",
      "title": "World Cup — The Leading O Becomes the Ball",
      "theme": "worldcup",
      "fmt": "Video · 9:16",
      "holiday": "USA · 1st knockout",
      "caption": "⚽ Always rooting for the home team — we're on your side when you make your move. (USA vs. Bosnia & Herzegovina, the US's first knockout match, Round of 32, Levi's Stadium.)",
      "socialCaption": "knockouts start today. always rooting for the home team. ⚽",
      "canva": "DAHOFqh_g5g",
      "media": {
        "img": "previews/worldcup.png",
        "slides": [],
        "video": ""
      },
      "postedUrl": "",
      "updatedAt": "2026-07-16T16:05:50.340Z"
    },
    {
      "id": "seed-2",
      "status": "scheduled",
      "date": "2026-07-02",
      "title": "Skip the Circus — Banner Drop",
      "theme": "meme",
      "fmt": "Static · 3:4",
      "holiday": "",
      "caption": "Reskin of the viral banner-drop stunt (Blue Apron 'hot dogs' post): masked climbers atop a skyscraper mast unfurl a flag reading 'Skip the circus / Skip straight to sold / opendoor.com.' Deadpan, screenshot-y — 'wait, is this real?' energy. Scheduled for AM.",
      "socialCaption": "some people really love Opendoor",
      "canva": "",
      "media": {
        "img": "previews/skip-circus.png",
        "slides": [],
        "video": ""
      },
      "postedUrl": "",
      "updatedAt": "2026-07-06T19:44:16.893Z"
    },
    {
      "id": "seed-3",
      "status": "scheduled",
      "date": "2026-07-02",
      "title": "Wimbledon — The Grass Is Truly Greener",
      "theme": "seasonal",
      "fmt": "Static · 3:4",
      "holiday": "🎾 Wimbledon",
      "caption": "🎾 Grass-season brand post for Wimbledon week 1. A 3×3 grid of green front doors (middle-America mix); 'the grass is truly greener' on the other side of an Opendoor.",
      "socialCaption": "turns out the grass really is greener over here. 🎾",
      "canva": "DAHOKZYzGc4",
      "media": {
        "img": "previews/wimbledon-doors.jpg",
        "slides": [],
        "video": ""
      },
      "postedUrl": "",
      "updatedAt": "2026-07-16T16:05:50.368Z"
    },
    {
      "id": "seed-4",
      "status": "scheduled",
      "date": "2026-07-03",
      "title": "Some Things Just Go Together — July",
      "theme": "seasonal",
      "fmt": "Static · 3:4",
      "holiday": "",
      "caption": "Hot dogs + the 4th. Home + Opendoor. The 'go together' series, July edition.",
      "socialCaption": "some things just belong together in july. 🇺🇸",
      "canva": "DAHN_aEi-KM",
      "media": {
        "img": "previews/go-together-july.png",
        "slides": [],
        "video": ""
      },
      "postedUrl": "",
      "updatedAt": "2026-07-16T16:05:50.397Z"
    },
    {
      "id": "seed-5",